{
  "protocol": "oebp",
  "version": "0.1.0",
  "kind": "InvocationFeedback",
  "metadata": {
    "id": "org.oebp.fixtures.invocation.feedback",
    "revision": "1.0.0",
    "created_at": "2026-06-16T09:00:00Z"
  },
  "spec": {
    "invocation_id": "invocation-001",
    "sequence": 1,
    "emitted_at": "2026-06-16T09:00:01Z",
    "state": "running",
    "current_node_id": "noop",
    "progress": {
      "ratio": 0.5,
      "message": "Executing fixture node."
    },
    "metrics": {
      "elapsed_ms": 1000
    },
    "trace_span_refs": [
      "trace.running"
    ]
  }
}
